{
  "binding": {
    "candidateDigest": "78bc8f2ae2deb6879884217bd4eb812145d35e384e1d89c0dd2aef92a6796d65",
    "engineArtifactDigest": "c7a8732d9a2bae2495492821672ef5f1890357a0b9eb6bd8c5b900e77d75e5ea",
    "extractorArtifactDigest": "c7a8732d9a2bae2495492821672ef5f1890357a0b9eb6bd8c5b900e77d75e5ea",
    "packetDigest": "b2318f615b1f5155f8c4018a01199cdeaf44dc73fa43a75f37f95db3670cc1cf",
    "repositoryRevision": "8627ba30fa72dd80a90867f0b2eef959446c0954",
    "toolchainDigest": "e7d0184546d40700dcef65df12b90147a03f54515e74128e47d6b507c8384d01",
    "worktreeDigest": "8a44828a6ac5e67fb000eb9d07a682caefcb3c4750dca0a2ee21f3f719e6d822"
  },
  "decidedAt": "2026-09-06T15:31:05Z",
  "decision": "approve",
  "decisionDigest": "05f8005362358615cf04e567ec034b9c1b906d925273fef870d09f1daa0e91d0",
  "kind": "BlueprintDecisionRecord",
  "proposalId": "engine-self-adoption-20260906",
  "rationale": "I authorize the version-only amendment to bce-engine-architecture@0.1.1 as the repository solo steward. All 47 constraints, severities, scope, intent references, and approval requirements remain unchanged, and the real source proof kills all 47 mutants. Enforcement remains enabled. This decision is self-ratified; independent review and product efficacy are not claimed. The coding agent executes this recorded transition under my authorization.",
  "reviewer": {
    "authentication": {
      "assertionDigest": "55f5a663260fee365486af41292d73e376707e465029855a80b9c91cec007797",
      "issuer": "https://github.com",
      "method": "scm",
      "reference": "https://github.com/blueprint-conformance/bce/pull/73#pullrequestreview-5125802265",
      "reviewMode": "self-ratified",
      "subject": "github:user:243248197"
    },
    "id": "github:user:243248197"
  },
  "satisfiedRequirement": {
    "role": "maintainer",
    "stage": "ratify"
  },
  "schemaVersion": "1",
  "weakeningAccepted": false
}
